{"schema":"urn:aihq:report:snapshot:1.0.0","compatibility":"experimental","producer":{"name":"@aihq/core","version":"1.0.0-dev.5","revision":null,"contract":"urn:aihq:harness:diagnostic:1.0.0"},"capture":{"observedAt":"2026-10-04T03:18:42.576Z","acquisition":"newly-acquired"},"evidence":{"originalSha256":null,"authentication":"not-authenticated","structuralValidation":"passed","projection":"redacted"},"status":"completed","tools":[{"id":"node","label":"Node.js","state":"runnable","selection":"requested"},{"id":"npm","label":"npm","state":"binary","selection":"unselected"},{"id":"git","label":"Git","state":"runnable","selection":"requested"},{"id":"python","label":"Python","state":"binary","selection":"unselected"},{"id":"pip","label":"pip","state":"binary","selection":"unselected"},{"id":"cargo","label":"Cargo","state":"absent","selection":"unselected"},{"id":"conda","label":"conda","state":"absent","selection":"unselected"},{"id":"claude","label":"Claude Code","state":"binary","selection":"unselected"},{"id":"codex","label":"Codex CLI","state":"binary","selection":"unselected"},{"id":"cursor","label":"Cursor","state":"binary","selection":"unselected"},{"id":"gemini","label":"Gemini CLI","state":"absent","selection":"unselected"},{"id":"copilot","label":"GitHub Copilot","state":"absent","selection":"unselected"},{"id":"windsurf","label":"Windsurf","state":"absent","selection":"unselected"},{"id":"opencode","label":"OpenCode","state":"binary","selection":"unselected"},{"id":"kimi","label":"Kimi Code","state":"binary","selection":"unselected"},{"id":"kiro","label":"Kiro","state":"binary","selection":"unselected"},{"id":"rg","label":"ripgrep","state":"binary","selection":"unselected"},{"id":"fd","label":"fd","state":"binary","selection":"unselected"},{"id":"jq","label":"jq","state":"binary","selection":"unselected"},{"id":"curl","label":"curl","state":"binary","selection":"unselected"},{"id":"keytool","label":"Java keytool","state":"absent","selection":"unselected"},{"id":"bash","label":"Bash","state":"binary","selection":"unselected"},{"id":"antigravity","label":"Google Antigravity","state":"absent","selection":"unselected"},{"id":"zed","label":"Zed","state":"absent","selection":"unselected"}],"observations":[{"id":"node/version","target":"node","detail":"Runnable version command observed."},{"id":"git/version","target":"git","detail":"Runnable version command observed."}],"checks":[{"id":"node/version","target":"node","outcome":"passed","reason":"version-ok","detail":"The version command exited successfully; its raw output was not retained."},{"id":"git/version","target":"git","outcome":"passed","reason":"version-ok","detail":"The version command exited successfully; its raw output was not retained."}],"diagnostics":[],"metrics":{"budgetMs":180000,"elapsedMs":5265,"maxActiveProbes":2,"counts":{"passed":2,"failed":0,"unavailable":0,"skipped":0}}}